{
  "artifacts": [
    {
      "node_id": "vscore-program",
      "path": "program.vscore.json",
      "role": "source",
      "slot_id": "vscore-source"
    },
    {
      "node_id": "vscore-program",
      "path": "model.json",
      "role": "model",
      "slot_id": "vscore-model"
    },
    {
      "node_id": "vscore-program",
      "path": "profile.json",
      "role": "profile",
      "slot_id": "vscore-profile"
    },
    {
      "node_id": "vscore-program",
      "path": "relation.json",
      "role": "relation",
      "slot_id": "vscore-relation"
    },
    {
      "node_id": "vscore-program",
      "path": "Proof.lean",
      "role": "proof_source",
      "slot_id": "vscore-proof"
    },
    {
      "node_id": "vscore-program",
      "path": "support/readable/selection.json",
      "role": "readable_selection",
      "slot_id": "vscore-readable-selection"
    }
  ],
  "bridge_id": "implementation",
  "declared_trust": [
    {
      "description": "The delivered artifact is the VSCore source; its meaning is the verifier-owned VSCore 0.3 Lean semantics. Executing it with any host interpreter or compiler is outside this edge.",
      "id": "vscore-semantics",
      "kind": "semantics"
    },
    {
      "description": "Lean 4 kernel of the pinned toolchain and the axioms allowed by the accepted policy.",
      "id": "lean-kernel",
      "kind": "logic"
    }
  ],
  "edges": [
    {
      "claim_id": "BRIDGE:implementation:vscore-refinement",
      "edge_id": "reference-to-vscore",
      "expected_proposition_hash": "sha256:3d0149d39cfd28f5abffb243edff0d4df85839ea557be0587d3c5af1b9e91672",
      "premises": [],
      "relation_slot": "vscore-relation",
      "source_node": "accepted-contract",
      "target_node": "vscore-program"
    }
  ],
  "endpoint": "restricted_source",
  "format": "verislop.bridge-proposal/0.1",
  "nodes": [
    {
      "kind": "restricted_source",
      "model_slot": "vscore-model",
      "node_id": "vscore-program",
      "profile_slot": "vscore-profile"
    }
  ],
  "obligations": [
    {
      "id": "O1",
      "required_claims": [
        "BRIDGE:implementation:vscore-refinement"
      ]
    },
    {
      "id": "S1",
      "required_claims": [
        "BRIDGE:implementation:vscore-refinement"
      ]
    }
  ],
  "reproducible_slots": [
    "vscore-model",
    "vscore-profile",
    "vscore-proof",
    "vscore-readable-selection",
    "vscore-relation",
    "vscore-source"
  ],
  "schema_version": "0.1",
  "tier": 2
}
